{
  "command_type": "free-agent",
  "status": "complete",
  "session_id": "msmodelutl-skill-implementation-002",
  "parent_session_id": "msmodelutl-skill-implementation-001",
  "session_summary": "Extended implementation to properly deploy skills to commands/ directory, updated CLI to handle subdirectories, and created claude-commands-expert skill as a meta-skill for this repository.",

  "tasks": [
    {
      "task_id": "1.0",
      "description": "Create msmodelutl-expert skill directory structure",
      "status": "completed",
      "parent_task_id": null,
      "notes": "Created .claude/commands/msmodelutl-expert/context/ directory"
    },
    {
      "task_id": "2.0",
      "description": "Create main skill.md file with dynamic loading approach",
      "status": "completed",
      "parent_task_id": null,
      "notes": "Created msmodelutl-expert.md with dynamic loading of developer guide from ModelSEEDpy"
    },
    {
      "task_id": "3.0",
      "description": "Create context files (api-summary.md, patterns.md, integration.md)",
      "status": "completed",
      "parent_task_id": null,
      "notes": "Created three context files for quick reference"
    },
    {
      "task_id": "4.0",
      "description": "Copy msmodelutl-expert skill to commands/ directory",
      "status": "completed",
      "parent_task_id": null,
      "notes": "Copied skill files from .claude/commands/ to commands/ (the source directory)"
    },
    {
      "task_id": "5.0",
      "description": "Update CLI to handle subdirectories with rglob",
      "status": "completed",
      "parent_task_id": null,
      "notes": "Modified claude_commands.py to use rglob('*.md') instead of glob('*.md') for proper file counting and display of nested context files"
    },
    {
      "task_id": "6.0",
      "description": "Create claude-commands-expert skill for this repository",
      "status": "completed",
      "parent_task_id": null,
      "notes": "Created meta-skill that provides expertise on the ClaudeCommands system itself"
    }
  ],

  "files": {
    "created": [
      {
        "path": "commands/msmodelutl-expert.md",
        "purpose": "Main MSModelUtil expert skill definition",
        "type": "markdown"
      },
      {
        "path": "commands/msmodelutl-expert/context/api-summary.md",
        "purpose": "Condensed API quick reference with method tables",
        "type": "markdown"
      },
      {
        "path": "commands/msmodelutl-expert/context/patterns.md",
        "purpose": "Common usage patterns with code examples",
        "type": "markdown"
      },
      {
        "path": "commands/msmodelutl-expert/context/integration.md",
        "purpose": "Module integration map for MSModelUtil",
        "type": "markdown"
      },
      {
        "path": "commands/claude-commands-expert.md",
        "purpose": "Main ClaudeCommands expert skill definition",
        "type": "markdown"
      },
      {
        "path": "commands/claude-commands-expert/context/cli-reference.md",
        "purpose": "CLI command reference documentation",
        "type": "markdown"
      },
      {
        "path": "commands/claude-commands-expert/context/skill-development.md",
        "purpose": "Guide for developing new commands and skills",
        "type": "markdown"
      },
      {
        "path": "commands/claude-commands-expert/context/architecture.md",
        "purpose": "System architecture documentation",
        "type": "markdown"
      }
    ],
    "modified": [
      {
        "path": "claude_commands.py",
        "changes": "Updated glob('*.md') to rglob('*.md') in 4 locations to properly count and display nested context files in skill subdirectories"
      }
    ],
    "deleted": []
  },

  "artifacts": {
    "skills_created": ["msmodelutl-expert", "claude-commands-expert"],
    "skill_locations": {
      "msmodelutl-expert": "commands/msmodelutl-expert.md",
      "claude-commands-expert": "commands/claude-commands-expert.md"
    }
  },

  "queries_for_user": [],

  "comments": [
    "Skills are now properly located in commands/ directory (source of truth)",
    "CLI updated to handle subdirectories - shows 'X commands + Y context files' when deploying",
    "Expert skill pattern established: main .md file + optional context/ subdirectory",
    "Dynamic loading approach: skills read documentation at invocation time for current info",
    "Static context files: embedded patterns/references for fast access",
    "To use skills: /msmodelutl-expert <question> or /claude-commands-expert <question>",
    "Deploy to projects with: claude-commands update"
  ],

  "metrics": {
    "files_created": 8,
    "files_modified": 1,
    "skills_created": 2
  },

  "errors": []
}
